{
    "schema_version": 1,
    "pack_format": "ogmap-zip-v1",
    "pack_id": "synthetic-test",
    "name": "Synthetic Test Map Pack",
    "version": "0.1.0",
    "status": "draft",
    "reader_compatibility": {
        "minimum_version": "0.1.0"
    },
    "description": "Small manifest-only fixture for map-pack validation.",
    "region": {
        "name": "Synthetic Test Region",
        "bounds": [
            -123.0,
            45.0,
            -122.0,
            46.0
        ],
        "default_center": [
            -122.5,
            45.5
        ],
        "min_zoom": 0,
        "max_zoom": 10
    },
    "data_date": "2026-08-06",
    "estimated_installed_bytes": 3,
    "style_id": "emergency-basic",
    "tile_schema_id": "protomaps-basemap-v4",
    "files": [
        {
            "path": "data/basemap.pmtiles",
            "role": "basemap",
            "media_type": "application/vnd.pmtiles",
            "size_bytes": 1,
            "sha256": "0000000000000000000000000000000000000000000000000000000000000000",
            "required": true
        },
        {
            "path": "licenses/public-domain.txt",
            "role": "license",
            "media_type": "text/plain",
            "size_bytes": 1,
            "sha256": "1111111111111111111111111111111111111111111111111111111111111111",
            "required": true
        },
        {
            "path": "README.txt",
            "role": "readme",
            "media_type": "text/plain",
            "size_bytes": 1,
            "sha256": "2222222222222222222222222222222222222222222222222222222222222222",
            "required": true
        }
    ],
    "sources": [
        {
            "source_id": "synthetic",
            "name": "Synthetic Test Data",
            "source_page": "https://example.invalid/offgridpi/synthetic-map",
            "source_version": "0.1.0",
            "data_date": "2026-08-06",
            "license": "Public domain test fixture",
            "redistribution": "permitted",
            "attribution": "Synthetic test data",
            "notes": "Contains no real geographic data."
        }
    ],
    "limitations": [
        "Manifest-only fixture; no real map data is included."
    ]
}
